{
  "version": "1.0",
  "id": "c-interview-clip",
  "topic": "자동화 파이프라인 설계 원칙",
  "language": "ko",
  "platform": "shorts",
  "template": "C",
  "aspect_ratio": "9:16",
  "duration_sec": 20,
  "canvas": {
    "width": 1080, "height": 1920, "fps": 30,
    "safe_area": { "top": 250, "bottom": 250, "left": 60, "right": 60 }
  },
  "hook": { "text": "렌더러에 판단 로직을 넣지 마세요", "position": "top_safe", "start": 0.0, "end": 2.0, "lines": 2 },
  "shots": [
    { "index": 0, "start": 0.0, "end": 1.2, "visual_type": "face", "visual_source": { "kind": "avatar" }, "framing": "medium", "subject_position": "upper_center", "caption": "판단은 검증기에서", "caption_position": "lower_safe", "caption_role": "body_text", "motion": "static", "transition_in": "cut", "purpose": "hook" },
    { "index": 1, "start": 1.2, "end": 2.4, "visual_type": "screen", "visual_source": { "kind": "screen_capture" }, "framing": "closeup", "subject_position": "center", "caption": "스키마가 계약이다", "caption_position": "lower_safe", "caption_role": "body_text", "motion": "zoom_in", "transition_in": "jump_cut", "purpose": "hook" },
    { "index": 2, "start": 2.4, "end": 5.0, "visual_type": "face", "visual_source": { "kind": "avatar" }, "framing": "medium", "subject_position": "upper_center", "caption": "LLM은 대본만 만든다", "caption_position": "lower_safe", "caption_role": "body_text", "badge": "1", "motion": "static", "transition_in": "cut", "purpose": "point" },
    { "index": 3, "start": 5.0, "end": 7.5, "visual_type": "broll", "visual_source": { "kind": "stock", "query": "code editor json schema close up" }, "framing": "closeup", "subject_position": "center", "caption": "검증기가 반송한다", "caption_position": "lower_safe", "caption_role": "body_text", "motion": "pan", "transition_in": "cut", "purpose": "demo" },
    { "index": 4, "start": 7.5, "end": 10.0, "visual_type": "face", "visual_source": { "kind": "avatar" }, "framing": "medium", "subject_position": "upper_center", "caption": "렌더러는 결정적으로", "caption_position": "lower_safe", "caption_role": "body_text", "badge": "2", "motion": "static", "transition_in": "cut", "purpose": "point" },
    { "index": 5, "start": 10.0, "end": 12.0, "visual_type": "broll", "visual_source": { "kind": "stock", "query": "hands gesturing whiteboard diagram" }, "framing": "closeup", "subject_position": "center", "caption": "레이어 분리", "caption_position": "lower_safe", "caption_role": "body_text", "motion": "push", "transition_in": "whip", "purpose": "interrupt", "pattern_interrupt": true },
    { "index": 6, "start": 12.0, "end": 14.5, "visual_type": "face", "visual_source": { "kind": "avatar" }, "framing": "closeup", "subject_position": "upper_center", "caption": "주제만 바꿔 재사용", "caption_position": "lower_safe", "caption_role": "body_text", "badge": "3", "motion": "static", "transition_in": "cut", "purpose": "point" },
    { "index": 7, "start": 14.5, "end": 17.0, "visual_type": "screen", "visual_source": { "kind": "screen_capture" }, "framing": "medium", "subject_position": "center", "caption": "같은 스키마, 다른 주제", "caption_position": "lower_safe", "caption_role": "body_text", "motion": "static", "transition_in": "cut", "purpose": "demo" },
    { "index": 8, "start": 17.0, "end": 20.0, "visual_type": "face", "visual_source": { "kind": "avatar" }, "framing": "medium", "subject_position": "upper_center", "caption": "저장하고 다음 편 보기", "caption_position": "cta_center", "caption_role": "cta_text", "motion": "static", "transition_in": "cut", "purpose": "cta" }
  ],
  "cta": { "text": "저장하고 다음 편 보기", "position": "cta_center", "start": 17.0, "end": 20.0, "action": "follow" },
  "loop_ending": false,
  "styles": {
    "hook": { "font_weight": 900, "font_size": 76, "color": "#FFFFFF", "stroke_width": 6, "scrim": "gradient_top", "align": "center" },
    "caption": { "font_weight": 700, "font_size": 56, "color": "#FFFFFF", "stroke_width": 4, "scrim": "gradient_bottom", "align": "center" },
    "cta": { "font_weight": 900, "font_size": 66, "color": "#FFFFFF", "stroke_width": 0, "scrim": "box", "align": "center" }
  },
  "audio": { "music_style": "soft background pad", "bpm_hint": 90, "beat_sync_cuts": false, "voiceover": { "enabled": false } }
}
